<?xml version="1.0" encoding="UTF-8"?>
<!DOCTYPE library SYSTEM "dvd.dtd">
<library>
  <dvd id="1">
	 <title>Gone with the Wind</title>
	 <format>Movie</format>
	 <genre>Classic</genre>
  </dvd>
  <dvd id="2"><br/>
	 <title>Star Trek</title>
	 <format>TV Series</format>
	 <genre>Science fiction</genre>
  </dvd>
</library>
